{
  "generatedFieldOwnership": {
    "descriptorFields": [
      "bytes",
      "sha256",
      "canonicalization",
      "contentSha256",
      "closure",
      "sealReceipt",
      "sealedAtUtc",
      "toolVersion"
    ],
    "generatedFiles": [
      "bbk-package.json",
      "bbk-package-manifest.json",
      "bbk-seal-receipt.json"
    ],
    "owner": "tools/artifact_packages.py"
  },
  "packageVersion": "0.1.0-alpha.16.1",
  "profiles": [
    {
      "artifactReferenceCycles": "FORBIDDEN",
      "artifactRoles": [
        "semantic",
        "context",
        "result",
        "evidence",
        "candidate",
        "source",
        "documentation",
        "fixture",
        "other"
      ],
      "description": "Generic local artifact package with declared local references.",
      "descriptorSchema": "bbk-artifact-package-draft-v1.schema.json",
      "id": "generic",
      "permittedSchemas": [
        "*"
      ],
      "requiredSchemas": [],
      "semanticValidators": [],
      "successorClearPointers": [],
      "version": "1"
    },
    {
      "artifactReferenceCycles": "FORBIDDEN",
      "artifactRoles": [
        "result",
        "evidence",
        "context",
        "other"
      ],
      "description": "Sealed v2 handoff package.",
      "descriptorSchema": "bbk-artifact-package-draft-v1.schema.json",
      "id": "handoff-v2",
      "permittedSchemas": [
        "bbk.handoff.v2",
        "bbk.evidence-receipt.v2",
        "*"
      ],
      "requiredSchemas": [
        "bbk.handoff.v2"
      ],
      "semanticValidators": [
        "handoff-subject-binding"
      ],
      "successorClearPointers": [
        "/attempt",
        "/continuation/checkpoint"
      ],
      "version": "1"
    },
    {
      "artifactReferenceCycles": "FORBIDDEN",
      "artifactRoles": [
        "result",
        "evidence",
        "context",
        "other"
      ],
      "description": "Role return v2 package with compact or full detail.",
      "descriptorSchema": "bbk-artifact-package-draft-v1.schema.json",
      "id": "role-return-v2",
      "permittedSchemas": [
        "bbk.role-return.v2",
        "bbk.evidence-receipt.v2",
        "*"
      ],
      "requiredSchemas": [
        "bbk.role-return.v2"
      ],
      "semanticValidators": [
        "executor-identity"
      ],
      "successorClearPointers": [
        "/attempt",
        "/generated_at",
        "/effects/attempt_owned"
      ],
      "version": "1"
    },
    {
      "artifactReferenceCycles": "FORBIDDEN",
      "artifactRoles": [
        "context",
        "source",
        "evidence",
        "other"
      ],
      "description": "Mechanically generated standard Worker invocation/context package.",
      "descriptorSchema": "bbk-artifact-package-draft-v1.schema.json",
      "id": "worker-context-v1",
      "permittedSchemas": [
        "bbk.worker-context-package.v1",
        "bbk.host-preflight-result.v1",
        "bbk.profile-lock.v1",
        "bbk.prototype-charter.v2",
        "*"
      ],
      "requiredSchemas": [
        "bbk.worker-context-package.v1"
      ],
      "semanticValidators": [],
      "successorClearPointers": [
        "/admission",
        "/hostPreflight/cache"
      ],
      "version": "1"
    },
    {
      "artifactReferenceCycles": "FORBIDDEN",
      "artifactRoles": [
        "context",
        "candidate",
        "evidence",
        "result",
        "other"
      ],
      "description": "Generated review or focused recheck context package.",
      "descriptorSchema": "bbk-artifact-package-draft-v1.schema.json",
      "id": "review-package-v2",
      "permittedSchemas": [
        "bbk.review-package.v2",
        "bbk.review-finding.v1",
        "bbk.evidence-receipt.v2",
        "*"
      ],
      "requiredSchemas": [
        "bbk.review-package.v2"
      ],
      "semanticValidators": [
        "review-candidate-binding"
      ],
      "successorClearPointers": [
        "/attempt",
        "/findings"
      ],
      "version": "1"
    },
    {
      "artifactReferenceCycles": "FORBIDDEN",
      "artifactRoles": [
        "candidate",
        "evidence",
        "context",
        "documentation",
        "other"
      ],
      "description": "Integrated candidate package for bounded review and release evidence.",
      "descriptorSchema": "bbk-artifact-package-draft-v1.schema.json",
      "id": "candidate-package-v1",
      "permittedSchemas": [
        "bbk.candidate-package.v1",
        "*"
      ],
      "requiredSchemas": [
        "bbk.candidate-package.v1"
      ],
      "semanticValidators": [
        "candidate-subject-binding"
      ],
      "successorClearPointers": [],
      "version": "1"
    }
  ],
  "registryVersion": "1",
  "schema": "bbk.artifact-package-profile-registry.v1"
}
